publish_date,publish_time,title,body_text,url
2025-05-27,07:03,StanChart sees Solana price rising over 50% by end of 2025 By Investing.com,"Investing.com -- Standard Chartered has begun coverage on (SOL) with a year-end 2025 price target of $275, implying a gain of more than 50% from current levels around $175.

While the bank acknowledges that Solana is likely to underperform over the next two to three years, it sees longer-term potential for the network once new sectors start to scale.

“Solana is a fast, cheap alternative to Ethereum; as a result, it has dominated memecoin trading,” said Geoff Kendrick, Global Head of Digital Assets Research at Standard Chartered, said, citing the network’s superior transaction throughput and reliability.

However, he notes that memecoin activity is “being discounted to a quantifiable degree by markets,” which has contributed to Solana trading “cheap” relative to its achieved application revenue, or “GDP.”

Most of Solana’s current usage is concentrated in trading applications, particularly decentralized exchanges that facilitate high-volume, low-value memecoin transactions. While this has helped stress-test the network’s capabilities, Kendrick warns that the associated revenues may be unsustainable.

“Solana trades ‘cheap’ on our market cap-to-GDP metric,” the analyst said, attributing this to a “more aggressive discount factor” being applied to future earnings compared to other chains.

“Put another way, Solana’s recent high fees and high activity on the back of memecoin trading may be seen as unsustainable,” Kendrick explained.

Looking ahead, Standard Chartered sees potential for Solana to dominate in emerging sectors like decentralized social media, high-throughput financial applications, and infrastructure platforms, though it expects these use cases to take two to three years to scale.

“The key to Solana’s future success will be to take its core advantage in transaction confirmation (fast, cheap and reliable) and apply it to something other than memecoin trading,” Kendrick continued.

Beyond the near-term challenges, the analyst forecasts SOL at $310 by end-2026 and $500 by end-2029. Standard Chartered’s year-end target for 2025 is $275.",https://www.investing.com/news/cryptocurrency-news/stanchart-sees-solana-price-rising-over-50-by-end-of-2025-4064655
2025-05-27,06:26,Citi sees up to 8% downside for Stoxx 600 on Trump tariff risk By Investing.com,"Investing.com -- Citi analysts warned in a note Tuesday that European equities could face significant downside if President Trump’s tariff threats materialize.

The bank outlined the potential implications of a 50% tariff on European goods, a scenario the firm is treating as hypothetical for now but one that has already rattled markets.

While Trump said on Sunday that he has agreed to delay the 50% tariff on the European Union until July 9, Citi noted that the “surprise announcement on a possible 50% tariff on European goods” had triggered broad selling in European equities.

The Index could drop “c7-8% from here” if the tariff threats are enacted and priced in, according to Citi’s projections.

Earnings estimates for European companies have already started to reflect increased geopolitical risks.

“Analyst consensus forecasts for 2025E European EPS growth have fallen from +7% pre-Liberation day to c2% now,” Citi noted. That decline is said to be consistent with their prior modeling of the earnings impact from a 20% tariff.

However, should tariffs rise to 50%, Citi’s top-down models suggest EPS growth could deteriorate further.

“EPS growth could fall another 5-6% to c-4%, if 50% broad tariffs are implemented,” they warned. “This comes against the backdrop of the market pricing in c4% EPS growth over the next 12m.”

Citi emphasized that the uncertainty surrounding trade policy is already dragging down sentiment and could translate into more pronounced equity declines if the threats are realized.",https://www.investing.com/news/stock-market-news/citi-sees-up-to-8-downside-for-stoxx-600-on-trump-tariff-risk-4064531
2025-05-26,19:58,"Stock market today: S&P 500 rallies on consumer confidence, Trump EU tariff delay By Investing.com","Investing.com-- The S&P 500 rose sharply Tuesday after U.S. consumer confidence rebounded following a five-month slump, cooling fears about the economy just days after President President Donald Trump postponed plans to impose steep trade tariffs on the European Union.

At 4:00 p.m. ET (20:00 GMT), the rose 740 points, or 1.8%, the index gained 2.1%, and the advanced 2.5%.

Wall Street was closed on Monday on account of the Memorial Day holiday.

Consumer confidence jumps by the most in four years

Consumer confidence saw a strong rebound in May, ending a five-month decline, largely driven by renewed optimism surrounding economic conditions and boosted further by the U.S.-China trade deal announced mid-month.

According to The Conference Board, the Consumer Confidence Index surged 12.3 points to 98.0, surpassing expectations of just 87.1. The sharp rise was fueled by improvements in both consumers’ short-term outlook—reflected in the Expectations Index jumping 17.4 points to 72.8—and perceptions of current conditions, with the Present Situation Index up 4.8 points to 135.9.

Senior Economist Stephanie Guichard noted that confidence was already improving ahead of the trade deal but accelerated in its aftermath, highlighting the deal’s positive impact on consumer sentiment.

Tech rallies as Nvidia (NASDAQ: )’s earnings loom large; Tesla (NASDAQ: ), Coreweave jump

Big tech stocks led market higher, with Nvidia rising more than 3% ahead of its quarterly results due Wednesday after the market closes.

The company is considered a bellwether for global AI demand, especially in the chipmaking sector, and is sitting on a massive valuation spike over the past two years on this position.

Nvidia is expected to report bumper earnings, especially as Wall Street’s so-called AI Hyperscalers– its biggest customers– continued to spend heavily on AI over the past three months.

Elsewhere, Southwest Airlines (NYSE: ) stock rose after the carrier announced it will charge customers $35 for one checked bag and $45 for the second, bringing an end to its free luggage policy.

Salesforce (NYSE: ) stock gained after the Wall Street Journal reported that the software company is nearing an agreement to acquire Informatica in a deal valued at approximately $8 billion.

The quarterly earnings season is largely at an end, with more than 95% of companies having already reported, with almost 78% having surpassed analyst expectations, according to FactSet.

Numbers from IT service management company Okta (NASDAQ: ) are due after the bell Tuesday.

Elsewhere, Tesla climbed more than 6% after CEO Elon Musk said he would be ""super focused on /xAI and Tesla (plus Starship launch next week), as we have critical technologies rolling out.”

The remarks helped further restore confidence in Musk’s leadership amid concerns that his role within the Trump administration was taking too much of his focus.

CoreWeave Inc (NASDAQ: ) rose more than 20%, shrugging off a downgrade from Barclays to equalweight, citing concerns about limited short-term upside given the stock’s post-IPO run up.

Trump postpones 50% EU tariffs to July

Sentiment received a boost after Trump stated late Sunday that he had agreed to postpone his recently proposed 50% tariffs on goods from the EU to July 9, following a call with EU President Ursula von der Leyen.

Trump also said that his administration will begin trade talks in earnest with the EU, while Von Der Leyen also flagged improving relations with Washington.

The development offered some relief to markets, which were rattled on Friday by Trump threatening steep tariffs on the EU, along with Apple (NASDAQ: ).

This resulted in a losing week on Wall Street, with all three major indices falling more than 2% over the course of last week.

The July 9 deadline is also around when Trump’s “reciprocal” tariffs are set to take effect, and the market’s remain focused on whether major U.S. trading partners can clinch agreements with Washington before the deadline.

More Fed speeches due

The U.S. president’s latest U-turn on EU tariffs reinforces how unpredictable his trade policies can be and undermines already fragile investor confidence in the U.S. economy.

An illustration of this uncertainty came with the orders for long-lasting U.S. manufactured goods, which slumped in April, falling after the previous month’s sharp gains.

Orders for –items designed to last three years or more–fell 6.3% last month after a hefty revised 7.6% gain in March, the Commerce Department’s Census Bureau said on Tuesday.

Transportation equipment, down following four consecutive monthly increases, drove the decrease, falling $20.3 billion or 17.1 percent to $98.8 billion.

Minneapolis Federal Reserve President on Tuesday continued to call for a pause rates until there was more uncertainty on the tariff impact.

Investors are also likely Tuesday to carefully study commentary from Fed Governor Christopher Waller and New York Fed President and adding to a series of comments from their colleagues last week.

Ambar Warrick and Peter Nurse contributed to this article",https://www.investing.com/news/stock-market-news/us-stock-futures-jump-as-trump-delays-50-tariffs-against-the-eu-4063878
